{
  "direction": "minimal editorial watchface with a warm accent and high contrast",
  "style": "minimal",
  "mood": "calm",
  "language": "en-US",
  "mustInclude": ["time", "date", "battery"],
  "avoid": ["clutter", "overlap", "small unreadable text"],
  "palette": ["#101318", "#F4F1EA", "#D0A85C"]
}
